{
  "schema": "drawio-skill/diagram-ir/v1",
  "metadata": {"title": "Checkout sync", "created": "2026-09-01T00:00:00+00:00"},
  "nodes": [
    {"id": "gateway", "label": "API Gateway", "kind": "gateway", "properties": {"owner": "platform"}, "provenance": {"path": "examples/architecture-studio/sync-baseline.ir.json"}},
    {"id": "orders", "label": "Orders API", "kind": "service", "properties": {"owner": "checkout-team"}, "provenance": {"path": "examples/architecture-studio/sync-baseline.ir.json"}},
    {"id": "db", "label": "Orders DB", "kind": "database", "properties": {"owner": "checkout-team"}, "provenance": {"path": "examples/architecture-studio/sync-baseline.ir.json"}}
  ],
  "edges": [
    {"id": "gateway-orders", "source": "gateway", "target": "orders", "label": "HTTPS", "kind": "sync", "properties": {"protocol": "HTTPS"}},
    {"id": "orders-db", "source": "orders", "target": "db", "label": "TLS", "kind": "sync", "properties": {"protocol": "TLS"}}
  ],
  "views": []
}
